{"type":"config","name":"Browser CDN Bundle Size Reduction","metricName":"gzip_kb","metricUnit":"kb","bestDirection":"lower"}
{"run":1,"commit":"66d1459","metric":27.8466,"metrics":{"raw_kb":81.3759,"gzip_bytes":28515},"status":"keep","description":"Baseline: browser CDN bundle.min.js gzipped size","timestamp":1773739502093,"segment":0}
{"run":2,"commit":"d470cd1","metric":27.707,"metrics":{"raw_kb":80.75,"gzip_bytes":28372},"status":"keep","description":"terser compress passes: 3 — better dead code elimination and folding","timestamp":1773740097667,"segment":0}
{"run":3,"commit":"5c3ab44","metric":27.705,"metrics":{"raw_kb":80.75,"gzip_bytes":28370},"status":"keep","description":"terser compress ecma: 2017 — enables modern JS optimizations (arrow fns, etc)","timestamp":1773740122319,"segment":0}
{"run":4,"commit":"4fb42e8","metric":27.7031,"metrics":{"raw_kb":80.746,"gzip_bytes":28368},"status":"keep","description":"Remove unused breadcrumbData variable in fetch breadcrumb handler","timestamp":1773740201717,"segment":0}
{"run":5,"commit":"d447107","metric":27.6347,"metrics":{"raw_kb":80.539,"gzip_bytes":28298},"status":"keep","description":"terser: enable toplevel, unsafe_comps, unsafe_math, pure_getters","timestamp":1773740331815,"segment":0}
{"run":6,"commit":"d447107","metric":27.6406,"metrics":{"raw_kb":80.4257,"gzip_bytes":28304},"status":"discard","description":"hoist_funs + hoist_vars — worse gzipped despite better raw (hurts gzip patterns)","timestamp":1773740360912,"segment":0}
{"run":7,"commit":"84679cd","metric":27.5615,"metrics":{"raw_kb":79.2617,"gzip_bytes":28223},"status":"keep","description":"terser: unsafe_arrows — converts functions to arrows, saves ~1.3KB raw","timestamp":1773740408187,"segment":0}
{"run":8,"commit":"deb232e","metric":27.5556,"metrics":{"raw_kb":79.2792,"gzip_bytes":28217},"status":"keep","description":"terser: unsafe_methods — converts { m: function(){} } to { m(){} }","timestamp":1773740454372,"segment":0}
{"run":9,"commit":"deb232e","metric":27.5605,"metrics":{"raw_kb":79.1796,"gzip_bytes":28222},"status":"discard","description":"unsafe_proto + unsafe_regexp — no gzip improvement","timestamp":1773740480925,"segment":0}
{"run":10,"commit":"deb232e","metric":27.5605,"metrics":{"raw_kb":79.1796,"gzip_bytes":28222},"status":"discard","description":"terser compress module: true — no improvement","timestamp":1773740607266,"segment":0}
{"run":11,"commit":"0a4947f","metric":27.5527,"metrics":{"raw_kb":79.2792,"gzip_bytes":28214},"status":"keep","description":"terser: mangle.toplevel — mangle top-level variable names in IIFE","timestamp":1773740915529,"segment":0}
{"run":12,"commit":"6f63afa","metric":27.5488,"metrics":{"raw_kb":79.2783,"gzip_bytes":28210},"status":"keep","description":"Simplify _enhanceEventWithInitialFrame — remove redundant variable aliases","timestamp":1773741086965,"segment":0}
{"run":13,"commit":"6f63afa","metric":27.4599,"metrics":{"raw_kb":79.0488,"gzip_bytes":28119},"status":"checks_failed","description":"LazyLoadableIntegrations derivation — test fails, bundle names with hyphens don't match CDN filenames","timestamp":1773741164554,"segment":0}
{"run":14,"commit":"7e08808","metric":27.4785,"metrics":{"raw_kb":79.1464,"gzip_bytes":28138},"status":"keep","description":"Derive LazyLoadableIntegrations bundle names instead of storing duplicated strings","timestamp":1773741212058,"segment":0}
{"run":15,"commit":"7e08808","metric":27.4794,"metrics":{"raw_kb":79.1464,"gzip_bytes":28139},"status":"discard","description":"getReportDialogEndpoint: use URLSearchParams — no size improvement","timestamp":1773741260638,"segment":0}
{"run":16,"commit":"7e08808","metric":27.4794,"metrics":{"raw_kb":79.1464,"gzip_bytes":28139},"status":"discard","description":"terser collapse_vars — already default, no change","timestamp":1773741411236,"segment":0}
{"run":17,"commit":"4224030","metric":27.4716,"metrics":{"raw_kb":79.1201,"gzip_bytes":28131},"status":"keep","description":"terser compress ecma: 2020 — enables nullish coalescing, optional chaining in output","timestamp":1773741468627,"segment":0}
{"run":18,"commit":"4224030","metric":27.4716,"metrics":{"raw_kb":79.1201,"gzip_bytes":28131},"status":"discard","description":"output.ecma: 2020 — no additional improvement over compress.ecma","timestamp":1773741502202,"segment":0}
{"run":19,"commit":"4224030","metric":27.4716,"metrics":{"raw_kb":79.1201,"gzip_bytes":28131},"status":"discard","description":"unsafe_undefined — no change (void 0 same length as undefined)","timestamp":1773741633394,"segment":0}
{"run":20,"commit":"80dc43b","metric":27.4677,"metrics":{"raw_kb":79.1083,"gzip_bytes":28127},"status":"keep","description":"terser: increase compress passes from 3 to 5 — slightly more dead code found","timestamp":1773741912230,"segment":0}
{"run":21,"commit":"86f2f2d","metric":27.4648,"metrics":{"raw_kb":79.1083,"gzip_bytes":28124},"status":"keep","description":"Simplify isNativeFunction regex — shorter and more permissive [native code] check","timestamp":1773741953342,"segment":0}
{"run":22,"commit":"4fa3f22","metric":27.4619,"metrics":{"raw_kb":79.0859,"gzip_bytes":28121},"status":"keep","description":"Replace extension protocol array+some with regex test in _isEmbeddedBrowserExtension","timestamp":1773741998660,"segment":0}
{"run":23,"commit":"4fa3f22","metric":27.4619,"metrics":{"raw_kb":79.0859,"gzip_bytes":28121},"status":"discard","description":"Inline allowedAttrs array — terser already handles this","timestamp":1773742073674,"segment":0}
{"run":24,"commit":"2e68d10","metric":27.4541,"metrics":{"raw_kb":79.0361,"gzip_bytes":28113},"status":"keep","description":"DEFAULT_EVENT_TARGET: use comma-separated string.split instead of array literal (51B raw savings)","timestamp":1773742154648,"segment":0}
{"run":25,"commit":"1f56ec6","metric":27.4531,"metrics":{"raw_kb":79.0058,"gzip_bytes":28112},"status":"keep","description":"LAZY_LOADABLE_NAMES: use comma-separated string.split (31B raw savings)","timestamp":1773742218321,"segment":0}
{"run":26,"commit":"2de668c","metric":27.4521,"metrics":{"raw_kb":79.0058,"gzip_bytes":28111},"status":"keep","description":"Verify current state after resume — matches previous best","timestamp":1773742393426,"segment":0}
{"run":27,"commit":"160fc3b","metric":27.4423,"metrics":{"raw_kb":78.9306,"gzip_bytes":28101},"status":"keep","description":"Rename sentryWrapped → sW in wrap() function, update frame stripping regex to match both names","timestamp":1773742621487,"segment":0}
{"run":28,"commit":"2c6b704","metric":27.4414,"metrics":{"raw_kb":78.9306,"gzip_bytes":28100},"status":"keep","description":"Simplify getOwnProperties: Object.fromEntries(Object.entries(obj)) instead of manual loop","timestamp":1773742723022,"segment":0}
{"run":29,"commit":"2c6b704","metric":27.4433,"metrics":{"raw_kb":78.9306,"gzip_bytes":28102},"status":"discard","description":"Consolidate sendSession aggregate/session logic — slightly worse gzip","timestamp":1773742823949,"segment":0}
{"run":30,"commit":"2c6b704","metric":27.4423,"metrics":{"raw_kb":78.8476,"gzip_bytes":28101},"status":"discard","description":"Extract browserapierrors mechanism prefix to MECH const — no gzip improvement (gzip already handles repetition)","timestamp":1773742978626,"segment":0}
{"run":31,"commit":"87a6b7b","metric":27.4326,"metrics":{"raw_kb":78.8593,"gzip_bytes":28091},"status":"keep","description":"Simplify getErrorPropertyFromObject: Object.values().find() instead of for-in loop with hasOwnProperty","timestamp":1773743038071,"segment":0}
{"run":32,"commit":"87a6b7b","metric":27.4326,"metrics":{"raw_kb":78.8593,"gzip_bytes":28091},"status":"discard","description":"Shorten DEFAULT_IGNORE_ERRORS patterns — no gzip improvement despite shorter raw strings","timestamp":1773743268715,"segment":0}
{"run":33,"commit":"aefd587","metric":27.4326,"metrics":{"raw_kb":78.8593,"gzip_bytes":28091},"status":"keep","description":"Remove redundant terser options (unsafe_undefined, collapse_vars already defaults) — cleaner config","timestamp":1773743358630,"segment":0}
{"run":34,"commit":"aefd587","metric":27.4326,"metrics":{"raw_kb":78.8593,"gzip_bytes":28091},"status":"discard","description":"Shorthand property value in addNonEnumerableProperty — terser already does this","timestamp":1773743516681,"segment":0}
{"run":35,"commit":"aefd587","metric":27.4326,"metrics":{"raw_kb":78.8593,"gzip_bytes":28091},"status":"discard","description":"ITEM_TYPE_TO_DATA_CATEGORY_MAP: remove self-mapping entries with fallback — gzip already handles the repetition","timestamp":1773743562933,"segment":0}
{"run":36,"commit":"aefd587","metric":27.4326,"metrics":{"raw_kb":78.8593,"gzip_bytes":28091},"status":"discard","description":"Replace SENTRY_BAGGAGE_KEY_PREFIX_REGEX.match with startsWith — no size change","timestamp":1773743750054,"segment":0}
{"run":37,"commit":"768a296","metric":27.4326,"metrics":{"raw_kb":78.8593,"gzip_bytes":28091},"status":"keep","description":"Remove stale output.ecma: 2020 from terser config (no effect on output)","timestamp":1773743877915,"segment":0}
{"run":38,"commit":"768a296","metric":27.4335,"metrics":{"raw_kb":78.8593,"gzip_bytes":28092},"status":"discard","description":"unsafe_Function terser option — 1 byte worse","timestamp":1773743908383,"segment":0}
{"run":39,"commit":"877c8d3","metric":27.4335,"metrics":{"raw_kb":78.8593,"gzip_bytes":28092},"status":"keep","description":"Resume session 3 — verify current state, matches previous best within noise","timestamp":1773744001010,"segment":0}
{"run":40,"commit":"7dec6bd","metric":27.2373,"metrics":{"raw_kb":78.0332,"gzip_bytes":27891},"status":"keep","description":"Simplify supportsNativeFetch: remove redundant iframe-based native check, just use _isFetchSupported. Saves ~200B gzipped.","timestamp":1773744250246,"segment":0}
{"run":41,"commit":"b34a609","metric":27.3496,"metrics":{"raw_kb":78.4687,"gzip_bytes":28006},"status":"keep","description":"Clean up leaked core changes from discarded experiments — revert api.ts, client.ts, eventFilters.ts, baggage.ts, browser.ts, envelope.ts, object.ts addNonEnumerableProperty","timestamp":1773744325376,"segment":0}
{"run":42,"commit":"90f676e","metric":27.3486,"metrics":{"raw_kb":78.4687,"gzip_bytes":28005},"status":"keep","description":"Update autoresearch.sh to auto-rebuild core/browser-utils when their sources change","timestamp":1773744370825,"segment":0}
{"run":43,"commit":"90f676e","metric":27.3486,"metrics":{"raw_kb":78.4707,"gzip_bytes":28005},"status":"discard","description":"baggage.ts: startsWith instead of match — no gzip change (now with proper core rebuild)","timestamp":1773744406629,"segment":0}
{"run":44,"commit":"3f15101","metric":27.3115,"metrics":{"raw_kb":78.3427,"gzip_bytes":27967},"status":"keep","description":"Slim ITEM_TYPE_TO_DATA_CATEGORY_MAP: remove self-mapping entries, fallback to type as category. Saves 38B gzipped.","timestamp":1773744474346,"segment":0}
{"run":45,"commit":"821ebe9","metric":27.2802,"metrics":{"raw_kb":78.2109,"gzip_bytes":27935},"status":"keep","description":"Shorten DEFAULT_IGNORE_ERRORS: simplify vv().getRestrictions and simulateEvent regex patterns. Saves 32B gzipped.","timestamp":1773744527049,"segment":0}
{"run":46,"commit":"fa1584a","metric":27.2646,"metrics":{"raw_kb":78.1191,"gzip_bytes":27919},"status":"keep","description":"Consolidate sendSession: unify aggregate/individual session release/env backfill logic. Saves 16B gzipped.","timestamp":1773744570757,"segment":0}
{"run":47,"commit":"d962c63","metric":27.2392,"metrics":{"raw_kb":78.0439,"gzip_bytes":27893},"status":"keep","description":"getReportDialogEndpoint: use URLSearchParams instead of manual encoding. Saves 26B gzipped.","timestamp":1773744610050,"segment":0}
{"run":48,"commit":"4db939e","metric":27.2373,"metrics":{"raw_kb":78.0332,"gzip_bytes":27891},"status":"keep","description":"core utils cleanup: shorthand value prop in addNonEnumerableProperty + inline allowedAttrs array. Saves 2B gzipped.","timestamp":1773744654491,"segment":0}
{"run":49,"commit":"4dd686f","metric":27.2314,"metrics":{"raw_kb":78.0322,"gzip_bytes":27885},"status":"keep","description":"Convert more DEFAULT_IGNORE_ERRORS strings to regexes (solana, _AutofillCallbackHandler). Saves 6B gzipped.","timestamp":1773744733596,"segment":0}
